Key,Context,Example,Source,en-us,ar-001,de-de,es-es,fr-fr,hi-in,id-id,it-it,ja-jp,ko-kr,pl-pl,pt-br,ru-ru,th-th,tr-tr,vi-vn,zh-cjv,zh-cn,zh-tw
Studio.R15Migrator.ScriptStatus.NoRules,,,No replace rules applied for selected scripts/issues,No replace rules applied for selected scripts/issues,لم يتم تطبيق قواعد استبدال على النصوص البرمجية/المشكلات المحدَّدة,Keine Ersetzungsregeln für ausgewählte Skripte/Probleme angewandt,No hay reglas de reemplazo aplicadas a los scripts o errores seleccionados,Aucune règle de remplacement appliquée pour les scripts/tickets sélectionnés,"चुनी गई स्क्रिप्ट्स/समस्याओं के लिए, कोई रीप्लेस किया गया नियम अप्लाई नहीं किया गया",Tidak ada aturan penggantian yang diterapkan untuk skrip/masalah yang dipilih,Nessuna regola di sostituzione applicata per script/issue selezionati,選択済みスクリプトまたは問題に置き換えルールが適用されていません,선택한 스크립트 또는 문제에 적용된 바꾸기 규칙이 없습니다,Nie zastosowano reguł zamieniania w odniesieniu do zaznaczonych skryptów/problemów,Nenhuma regra de substituição aplicada para scripts/problemas selecionada,,ไม่มีกฎการแทนที่ที่ปรับใช้กับสคริปต์/ปัญหาที่เลือก,Seçili betiklere/sorunlara değiştirme kuralı uygulanmadı,Không có quy tắc thay thế được áp dụng cho các kịch bản/vấn đề được chọn,没有适用于所选脚本 / 问题的替换规则,没有适用于所选脚本 / 问题的替换规则,沒有適用於選定指令碼/問題的替換規則
Studio.R15Migrator.ScriptStatus.PartiallyConverted,,,This script has been modified from its original state.,This script has been modified from its original state.,هذا النص البرمجي مختلف عن حالته الأصلية.,Dieses Skript wurde von seinem ursprünglichen Zustand modifiziert.,Este script se modificó desde su estado original.,Ce script a été modifié depuis son état d'origine.,इस स्क्रिप्ट को इसकी ओरिजिनल स्थिति से बदल दिया गया है.,Skrip ini telah dimodifikasi dari kondisi aslinya.,Questo script è stato modificato dal suo stato originale.,このスクリプトは元の状態から変更されています。,이 스크립트는 원래 상태에서 수정되었습니다.,Ten skrypt został zmodyfikowany od stanu początkowego.,Este script foi modificado de seu estado original.,,สคริปต์นี้ได้รับการแก้ไขจากสถานะดั้งเดิม,Bu betiğin orijinal durumu değişti.,Kịch bản này đã được sửa đổi từ trạng thái ban đầu.,此脚本已修改，不再是初始状态。,此脚本已修改，不再是初始状态。,此指令碼已自其原始狀態修改。
Studio.R15Migrator.ProgressBar.Convert,,,Converting Scripts,Converting Scripts,تحويل النصوص البرمجية,Skripte werden konvertiert,Convirtiendo scripts,Conversion des scripts,स्क्रिप्ट्स कन्वर्ट की जा रही हैं,Mengonversi Skrip,Conversione degli script,スクリプトを変換中,스크립트 변환 중,Konwertowanie skryptów,Convertendo scripts,,กำลังแปลงสคริปต์,Betikler dönüştürülüyor,Chuyển Đổi Kịch Bản,正在转换脚本,正在转换脚本,轉換指令碼
Studio.R15Migrator.InitialScanning.ScanButton,,,Start Scan,Start Scan,بدء المسح الضوئي,Scan starten,Comenzar escaneo,Commencer scan,स्कैन शुरू करें,Mulai Pemindaian,Avvia scansione,スキャンを開始,스캔 시작,Zacznij skanowanie,Iniciar verificação,,เริ่มการสแกน,Taramayı başlat,Bắt Đầu Quét,开始扫描,开始扫描,啟動掃描
Studio.R15Migrator.InitialScanning.ScanPrompt,,,"Click Start Scan to begin scanning place for animations, scripts, and models that need to be converted. This may take some time.","Click Start Scan to begin scanning place for animations, scripts, and models that need to be converted. This may take some time.","اضغط على ""بدء المسح الضوئي"" لبدء مسح المكان ضوئيًا بحثًا عن الحركات والنصوص البرمجية والنماذج التي تحتاج إلى تحويل. قد يستغرق إكمال هذه العملية بعض الوقت.","Klicke auf ""Scan starten"", um mit der Suche nach Animationen, Skripten und Modellen zu beginnen, die konvertiert werden müssen. Dies kann einige Zeit in Anspruch nehmen.","Haz clic en Comenzar escaneo para iniciar el escaneado del lugar en busca de animaciones, scripts y modelos que deban convertirse. Esto puede llevar algún tiempo.","Clique sur Démarrer l'analyse pour commencer à analyser le lieu à la recherche d'animations, de scripts et de modèles à convertir. Cette opération peut prendre un certain temps.","जिन ऐनिमेशन, स्क्रिप्ट और मॉडलों को कन्वर्ट करना है, उनके लिए प्लेस का स्कैन शुरू करने के लिए 'स्कैन शुरू करें' पर क्लिक करें. इस प्रोसेस में कुछ समय लग सकता है.","Klik Mulai Pemindaian untuk mulai memindai tempat serta mencari animasi, skrip, dan model yang perlu dikonversi. Proses ini mungkin memerlukan beberapa saat.","Fare clic su Avvia scansione per avviare la scansione del luogo alla ricerca di animazioni, script e modelli che devono essere convertiti. Questo potrebbe richiedere del tempo.",「スキャン開始」をクリックして、変換する必要があるプレースのアニメーション、スクリプト、モデルのスキャンを開始してください。これにはしばらく時間がかかるかもしれません。,"스캔 시작을 클릭해 변환해야 하는 애니메이션, 스크립트, 모델 위치의 스캔을 시작하세요. 다소 시간이 걸릴 수 있습니다.","Kliknij Zacznij skanowanie, aby rozpocząć skanowanie miejsca pod kątem animacji, skryptów i modeli, które należy przekonwertować. Może to zająć nieco czasu.","Clique em Iniciar escaneamento para começar o local de escaneamento de animações, scripts e modelos que precisam ser convertidos. Isso pode levar algum tempo.",,"คลิกเริ่มต้นกาสแกนเพื่อเริ่มการสแกนสถานที่ของแอนิเมชัน, สคริปต์ และโมเดลที่จำเป็นต้องได้รับการแปลง การดำเนินการนี้อาจใช้เวลาสักครู่","Mekândaki dönüştürülmesi gereken animasyonların, betiklerin ve modellerin taranmaya başlaması için Taramayı başlat seçeneğine tıkla. Bu işlem biraz zaman alabilir.","Nhấp vào Bắt Đầu Quét để quét địa điểm cho các hiệu ứng động, kịch bản và mô hình cần được chuyển đổi. Thao tác này có thể mất một lúc.",点按“开始扫描”以开始扫描需要转换的动画、脚本和模型的场景。这可能需要一些时间。,点按“开始扫描”以开始扫描需要转换的动画、脚本和模型的场景。这可能需要一些时间。,按下啟動掃描，開始掃描空間中需要轉換的動畫、指令碼與模型。這可能會花上一點時間。
Studio.R15Migrator.AnimationConversion.Animations,,,Animations,Animations,الحركات,Animationen,Animaciones,Animations,ऐनिमेशंस,Animasi,Animazioni,アニメーション,애니메이션,Animacje,Animações,,แอนิเมชัน,Animasyonlar,Hiệu Ứng Động,动画,动画,動畫
Studio.R15Migrator.AnimationConversion.Converted,,,Converted,Converted,تم التحويل,Konvertiert,Convertida,Converti,कन्वर्ट किया गया,Dikonversi,Convertito,変換済み,변환됨,Przekonwertowano,Convertida,,แปลงแล้ว,Dönüştürüldü,Đã Chuyển Đổi,已转换,已转换,已轉換
Studio.R15Migrator.AnimationConversion.Convert,,,Convert,Convert,تحويل,Konvertieren,Convertir,Convertir,कन्वर्ट करें,Konversi,Converti,変換,변환,Konwertuj,Converter,,แปลง,Dönüştür,Chuyển Đổi,转换,转换,轉換
Studio.R15Migrator.ScriptConversion.HeaderMessage,,,{scriptCount} Scripts {issueCount} Issues,{scriptCount} Scripts {issueCount} Issues,عدد النصوص البرمجية: {scriptCount}، وعدد المشكلات: {issueCount},{scriptCount} Skripte {issueCount} Probleme,{scriptCount} scripts {issueCount} problemas,{scriptCount} Scripts {issueCount} problèmes,{scriptCount} स्क्रिप्ट्स {issueCount} से जुड़ी समस्याएँ,{scriptCount} Skrip {issueCount} Masalah,{scriptCount} Script {issueCount} Problemi,スクリプト {scriptCount} 件 問題 {issueCount} 件,스크립트 {scriptCount}개 문제 {issueCount}건,"Liczba skryptów: {scriptCount}, liczba problemów: {issueCount}",{scriptCount} scripts {issueCount} problemas,,สคริปต์ {scriptCount} รายการ ัปัญหา {issueCount} รายการ,{scriptCount} Betik {issueCount} Sorun,{scriptCount} Kịch Bản {issueCount} Vấn Đề,{scriptCount} 个脚本 {issueCount} 个问题,{scriptCount} 个脚本 {issueCount} 个问题,{scriptCount} 個指令碼 {issueCount} 個問題
Studio.R15Migrator.ScriptAnalysis.R6ScriptErrorCode,,,R6 Script Error,R6 Script Error,خطأ في النص البرمجي R6,R6-Skriptfehler,Error de script R6,Erreur script R6,R6 स्क्रिप्ट में गड़बड़ी,Eror Skrip R6,R6 Script Error,R6 スクリプトエラー,R6 스크립트 오류,Błąd skryptu R6,Erro de script R6,,เกิดข้อผิดพลาดสคริปต์ R6,R6 Betik Hatası,Lỗi Kịch Bản R6,R6 脚本错误,R6 脚本错误,R6 指令碼錯誤
Studio.R15Migrator.ScriptAnalysis.R6ReferenceError,,,Reference to R6 Avatar found with {name},Reference to R6 Avatar found with {name},تم العثور على مرجع إلى أفاتار R6 مع {name},Referenz auf R6-Avatar gefunden mit {name},Referencia al avatar R6 encontrada con {name},Référence à l'avatar R6 trouvé avec {name},{name} के साथ मिले R6 अवतार का रेफ़रेंस,Referensi Avatar R6 ditemukan di {name},Riferimento all'Avatar R6 trovato con {name},{name} で見つかったR6アバターのリファレンス,{name}(으)로 찾은 R6 아바타 참조,{name} zawiera odwołanie do awatara R6,Referência a avatar R6 encontrado com {name},,พบการอ้างอิงอวาตาร์ R6 ด้วย {name},{name} adlı R6 Avatar referansı bulundu,Tham chiếu đến Avatar R6 được tìm thấy với {name},{name}有对 R6 虚拟形象的引用,{name}有对 R6 虚拟形象的引用,發現對於 R6 虛擬人偶的引用，其名稱為 {name}
Studio.R15Migrator.ScriptConversion.Revert,,,Revert,Revert,التراجع,Zurücksetzen,Revertir,Revenir en arrière,रिवर्ट करें,Kembalikan,Ripristina,元に戻す,되돌리기,Przywróć,Reverter,,แปลงกลับ,Geri Döndür,Hoàn Lại,还原,还原,還原
Studio.R15Migrator.ConversionResult.Complete,,,{count} references were successfully updated.,{count} references were successfully updated.,تم تحديث {count} من المراجع بنجاح.,{count} Referenzen wurden erfolgreich aktualisiert.,{count} referencias se actualizaron correctamente.,{count} références ont été mises à jour avec succès.,{count} रेफ़रेंस अपडेट हो गए हैं.,{count} referensi berhasil di-update.,{count} referenze sono state aggiornate correttamente.,参照 {count} 件を更新できました。,{count}개의 참조 업데이트를 완료했습니다.,Zaktualizowano {count} odwołania(-ń).,{count} scripts foram atualizados com sucesso.,,อัปเดตการอ้างอิงสำเร็จแล้ว {count} รายการ,{count} referans başarıyla güncellendi.,{count} tham chiếu đã được cập nhật thành công.,{count} 个引用已成功更新。,{count} 个引用已成功更新。,成功更新了 {count} 個引用。
Studio.R15Migrator.ConversionResult.Error,,,{count} references were skipped because no replacement rules were set for them.,{count} references were skipped because no replacement rules were set for them.,تم تخطي {count} من المراجع لأنه لم يتم إعداد قواعد استبدال لها.,"{count} Referenzen wurden übersprungen, da keine Ersetzungsregeln für sie festgelegt wurden.",{count} referencias se omitieron porque no se establecieron reglas de reemplazo para ellas.,{count} références ont été ignorées car aucune règle de remplacement n'a été définie pour elles.,"{count} रेफ़रेंस को छोड़ दिया गया, क्योंकि उनके लिए कोई रीप्लेसमेंट नियम सेट नहीं किया गया था.",{count} referensi dilewati karena tidak ada aturan penggantian yang diatur untuk referensi tersebut.,{count} referenze sono state saltate perché non sono state impostate regole di sostituzione.,{count} 件の参照は、置換ルールが設定されていないためスキップしました。,대체 규칙이 설정되지 않았기 때문에 {count}개의 참조를 건너뛰었습니다.,"Pominięto {count} odwołania(-ń), ponieważ nie ustalono dla nich reguł zamieniania.",{count} referências foram ignoradas porque não foram definidas regras de substituição para elas.,,ข้ามการอ้างอิงแล้ว {count} รายการเนื่องจากไม่มีกฎการแทนที่ที่กำหนดไว้สำหรับรายการเหล่านี้,Üzerlerinde değiştirme kuralı belirlenmediği için {count} referans atlandı.,{count} tham chiếu đã bị bỏ qua vì không có quy tắc thay thế nào được đặt cho chúng.,跳过了 {count} 个引用，这是由于没有为它们设置替换规则。,跳过了 {count} 个引用，这是由于没有为它们设置替换规则。,由於並未設定取代規則，因此跳過了 {count} 個引用。
Studio.R15Migrator.AnimationConversion.Preview,,,Preview,Preview,معاينة,Vorschau,Vista previa,Prévisualisation,प्रीव्यू,Preview,Anteprima,プレビュー,미리 보기,Podgląd,Prévia,,ดูตัวอย่าง,Ön İzle,Xem Trước,预览,预览,預覽
Studio.R15Migrator.CharacterConversion.Success,,,This character can be successfully converted to R15.,This character can be successfully converted to R15.,يمكن تحويل هذه الشخصية بنجاح إلى R15.,Dieser Charakter kann erfolgreich in R15 konvertiert werden.,Este personaje se puede convertir a R15 correctamente.,Ce personnage peut être converti en R15.,इस कैरेक्टर को R15 में कन्वर्ट किया जा सकता है.,Karakter ini dapat berhasil dikonversi menjadi R15.,Questo personaggio può essere convertito in R15.,このキャラクターはR15に変換できます。,이 캐릭터는 R15로 전환할 수 있습니다.,Tę postać można przekonwertować na R15.,Este personagem pode ser convertido com sucesso para R15.,,ตัวละครนี้สามารถแปลงเป็น R15 ได้สำเร็จ,Bu karakter başarıyla R15'e dönüştürülebilir.,Nhân vật này có thể được chuyển đổi thành công thành R15.,此角色已成功转换为 R15。,此角色已成功转换为 R15。,此角色可以成功轉換至 R15。
Studio.R15Migrator.CharacterConversion.Warning,,,We cannot find exact R15 replacement for this character and have provided parts from a default R15 character instead. Find more choices by using the Toolbox.,We cannot find exact R15 replacement for this character and have provided parts from a default R15 character instead. Find more choices by using the Toolbox.,لم نتمكن من العثور على استبدال R15 دقيق لهذه الشخصية، لذا وفرنا أجزاء من شخصية R15 افتراضية بدلاً من ذلك. يمكنك العثور على المزيد من الخيارات باستخدام صندوق الأدوات.,Wir können keinen exakten R15-Ersatz für diesen Charakter finden und haben stattdessen Teile aus einem Standard-R15-Charakter bereitgestellt. Weitere Auswahlmöglichkeiten findest du über die Toolbox.,No podemos encontrar el reemplazo exacto de R15 para este personaje y proporcionamos partes de un personaje R15 predeterminado. Encuentra más opciones usando la Caja de herramientas.,Nous ne pouvons pas trouver le remplacement exact de R15 pour ce personnage et avons fourni des pièces d'un personnage R15 par défaut. Trouve plus de choix en utilisant la Boîte à outils.,हमें इस कैरेक्टर के लिए सटीक R15 रीप्लेसमेंट नहीं मिल रहा है और हमने इसके बजाय डिफ़ॉल्ट R15 कैरेक्टर के पार्ट्स उपलब्ध कराए हैं. टूलबॉक्स का इस्तेमाल करके और विकल्प खोजें.,Kami tidak bisa menemukan pengganti R15 yang tepat untuk karakter ini dan telah memberikan komponen dari karakter R15 default sebagai gantinya. Temukan pilihan lainnya menggunakan Toolbox.,"Non riuscendo a trovare l'esatta sostituzione R15 per questo personaggio, abbiamo aggiunto le parti da un personaggio R15 predefinito. Per altre scelte, apri il Toolbox.",このキャラクターに代わるR15は見つからず、デフォルトのR15キャラクターからパーツを提供しています。ツールボックスを使って、もっと選択肢を見つけましょう。,이 캐릭터에 대한 정확한 R15 대체품을 찾을 수 없어 기본 R15 캐릭터의 파트를 적용했습니다. 도구 상자를 사용해 더 많은 선택 항목을 찾아 보세요.,"Nie można znaleźć dokładnych elementów do zamiany na R15 dla tej postaci i zamiast nich użyto części z domyślnej postaci R15. Więcej elementów do wyboru znajdziesz, korzystając z przybornika.","Não foi possível encontrar a substituição exata de R15 para este personagem e, em vez disso, fornecemos partes a partir de um caractere R15 padrão. Encontre mais escolhas usando a caixa de ferramentas.",,เราไม่พบการแทนที่ R15 ที่แน่ชัดของตัวละครนี้ และได้มอบส่วนประกอบจากตัวละคร R15 ค่าเริ่มต้นให้แทน ค้นหาตัวเลือกเพิ่มเติมโดยการใช้กล่องอุปกรณ์,Bu karakter için birebir R15 değişikliği bulamadık ve varsayılan R15 karakterinden parçalar aldık. Araç Kutusu ile daha fazla seçenek bul.,"Chúng tôi không thể tìm thấy bộ phận thay thế R15 chính xác cho nhân vật này, thay vào đó đã cung cấp các bộ phận từ một nhân vật R15 mặc định. Tìm thêm lựa chọn bằng cách sử dụng Hộp Công Cụ.",我们找不到该角色的确切 R15 替换项，改为提供了默认 R15 角色的部分。使用“工具箱”可查找更多选项。,我们找不到该角色的确切 R15 替换项，改为提供了默认 R15 角色的部分。使用“工具箱”可查找更多选项。,我們無法找到能在 R15 完全取代此角色的替代方式，因此改為提供預設的 R15 角色零件。請藉由使用工具箱找到更多的選擇。
Studio.R15Migrator.ScriptAnalysis.RigTypeWarning,,,"{name} found, consider changing to {suggestion}.","{name} found, consider changing to {suggestion}.",تم العثور على {name}، وننصح بتغييره إلى {suggestion}.,"{name} gefunden, erwäge die Änderung zu {suggestion}.","{name} encontrado, considera cambiar a {suggestion}.","{name} trouvé, envisage de changer pour {suggestion}.","{name} मिल गया, {suggestion} पर बदलने पर विचार करें.",{name} ditemukan. Pertimbangkan mengubahnya menjadi {suggestion}.,{name} trovato. Valuta di modificare come {suggestion}.,{name} が見つかりました。{suggestion} への変更を検討してください。,{name}(을)를 찾았습니다. {suggestion}(으)로 변경하는 걸 고려해 보세요.,"Znaleziono: {name}, rozważ zamianę na: {suggestion}.","{name} encontrado, considere mudar para {suggestion}.",,พบ {name} พิจารณาการเปลี่ยนแปลงเป็น {suggestion},"{name} bulundu, {suggestion} olarak değiştirilmesi önerilir.","Đã tìm thấy {name}, hãy xem xét đổi sang {suggestion}.",已找到 {name}，考虑更改为 {suggestion}。,已找到 {name}，考虑更改为 {suggestion}。,發現 {name}，建議變更為 {suggestion}。
Studio.R15Migrator.ScriptAnalysis.VariableReferenceWarning,,,Variable must reference {suggestion}.,Variable must reference {suggestion}.,يجب أن يشير المتغيّر إلى {suggestion}.,Variable muss {suggestion} referenzieren.,La variable debe hacer referencia a {suggestion}.,La variable doit faire référence {suggestion}.,वेरिएबल के लिए {suggestion} का रेफ़रेंस देना ज़रूरी है.,Variabel harus mereferensikan {suggestion}.,La variabile deve fare riferimento a {suggestion}.,変数は {suggestion} を参照する必要があります。,변수는 {suggestion}(을)를 참조해야 합니다.,Zmienna musi odwoływać się do: {suggestion}.,A variável deve fazer referência a {suggestion}.,,ตัวแปรต้องอ้างอิง {suggestion},Değişkenin {suggestion} referansı olması gerekir.,Biến phải tham chiếu đến {suggestion}.,变量必须引用 {suggestion}。,变量必须引用 {suggestion}。,變數必須參考 {suggestion}。
Studio.R15Migrator.AvatarSelection.DefaultAvatar,,,Default Avatar,Default Avatar,الأفاتار الافتراضي,Standard-Avatar,Avatar predeterminado,Avatar par défaut,डिफ़ॉल्ट अवतार,Avatar Default,Avatar predefinito,デフォルトのアバター,기본 아바타,Domyślny awatar,Avatar padrão,,อวาตาร์ค่าเริ่มต้น,Varsayılan Avatar,Avatar Mặc Định,默认虚拟形象,默认虚拟形象,預設虛擬人偶
Studio.R15Migrator.AvatarSelection.SelectAvatar,,,Select Avatar,Select Avatar,حدِّد أفاتار,Avatar auswählen,Seleccionar avatar,Sélectionner un avatar,अवतार चुनें,Pilih Avatar,Seleziona avatar,アバターの選択,아바타 선택,Zaznacz awatara,Selecionar avatar,,เลือกอวาตาร์,Avatar seç,Chọn Avatar,选择虚拟形象,选择虚拟形象,選擇虛擬人偶
Studio.R15Migrator.AvatarSelection.ChooseAvatarPlaceholder,,,Choose avatar...,Choose avatar...,جارٍ اختيار الأفاتار...,Avatar auswählen ...,Elegir avatar...,Choisir un avatar...,अवतार चुनें...,Pilih avatar...,Scegli avatar...,アバターを選択...,아바타 선택...,Wybierz awatara...,Escolher avatar...,,เลือกอวาตาร์...,Avatar seç...,Chọn Avatar...,选择虚拟形象……,选择虚拟形象……,選擇虛擬人偶...
Studio.R15Migrator.UploadAnimation.RobloxOwnedAnimation,,,Uploaded animation created by Roblox,Uploaded animation created by Roblox,الحركات التي تم رفعها والتي أنشأتها Roblox,Hochgeladene Animation wurde von Roblox erstellt,Animación cargada creada por Roblox,Animation téléchargée créée par Roblox,Roblox द्वारा बनाया गया ऐनिमेशन अपलोड किया गया,Berhasil meng-upload animasi yang dibuat oleh Roblox,Animazione caricata creata da Roblox,Robloxが作成したアニメーションをアップロードしました,Roblox에서 제작한 애니메이션을 업로드했습니다,Przesłane animacje zostały utworzone przez platformę Roblox,Animação carregada criada pela Roblox,,แอนิเมชันที่อัปโหลดแล้วซึ่งสร้างโดย Roblox,Roblox tarafından oluşturulan animasyon yüklendi,Hiệu ứng động đã tải lên được tạo bởi Roblox,已上传由 Roblox 创建的动画,已上传由 Roblox 创建的动画,由 Roblox 創作的動畫已上傳
Studio.R15Migrator.UploadAnimation.FailedSerialization,,,Serialization failed,Serialization failed,تعذَّر إجراء التسلسل,Serialisierung fehlgeschlagen,Error en la serialización,Échec de la sérialisation,क्रम में नहीं लगाया जा सका,Serialisasi gagal,Serializzazione non riuscita,シリアル化できません,직렬화 실패,Błąd serializacji,Falha na serialização,,ทำให้เป็นอนุกรมไม่สำเร็จ,Serileştirme başarısız,Chuỗi hóa không thành công,序列化失败,序列化失败,編序失敗
