Key,Context,Example,Source,en-us,ar-001,de-de,es-es,fr-fr,hi-in,id-id,it-it,ja-jp,ko-kr,pl-pl,pt-br,ru-ru,th-th,tr-tr,vi-vn,zh-cjv,zh-cn,zh-tw
Studio.R15Migrator.Finalizer.Description,,,Clean up temporary instances used for avatar compatability and backup data used during the conversion process.,Clean up temporary instances used for avatar compatability and backup data used during the conversion process.,قم بتنظيف الحالات المؤقتة المُستخدمة لضمان توافق الأفاتار وبيانات النسخ الاحتياطي المُستخدمة أثناء عملية التحويل.,"Temporäre Instanzen bereinigen, die für die Kompatibilität des Avatars verwendet werden, und Daten sichern, die während des Konvertierungsprozesses verwendet wurden.",Limpia las instancias temporales utilizadas para la compatibilidad con avatar y los datos de copia de seguridad usados durante el proceso de conversión.,Nettoyer les instances temporaires utilisées pour la compatibilité d'avatar et les données de sauvegarde utilisées pendant le processus de conversion.,"कन्वर्ज़न प्रोसेस के दौरान इस्तेमाल किए जाने वाले बैकअप डेटा और अवतार कंपैटिबिलिटी के लिए, इस्तेमाल किए जाने वाले अस्थायी इंस्टैंस को हटाएँ.",Menghapus instance sementara yang digunakan untuk kompatibilitas avatar dan data cadangan yang digunakan selama proses konversi.,Pulisci le istanze temporanee utilizzate per la compatibilità dell'avatar e i dati di backup utilizzati durante il processo di conversione.,アバターの互換性と変換プロセスで使用されたデータのバックアップに使用された一時的なインスタンスをクリーンアップします。,아바타 호환성을 위해 사용된 임시 인스턴스를 정리하고 변환 과정에서 사용된 백업 데이터를 정리합니다.,Wyczyść instancje tymczasowe użyte do zachowania zgodności awatara i utwórz kopię zapasową danych używanych w procesie konwersji.,Limpe as instâncias temporárias usadas para compatibilidade de avatar e dados de backup usados durante o processo de conversão.,,ล้างอินสแตนซ์ชั่วคราวที่ใช้สำหรับความเข้ากันได้ของอวาตาร์ และข้อมูลสำรองที่ใช้ในระหว่างกระบวนการแปลง,Avatar uyumluluğu için kullanılan geçici örnekleri ve dönüştürme sürecinde kullanılan yedek verileri temizle.,Dọn sạch các đối tượng tạm thời để đảm bảo tính tương thích của avatar và sao lưu dữ liệu trong quá trình chuyển đổi.,清理用于虚拟形象兼容的临时实例和在转换过程中使用的备份数据。,清理用于虚拟形象兼容的临时实例和在转换过程中使用的备份数据。,清除用於虛擬人偶相容性的暫時個體與轉換過程中使用的備份資料。
Studio.R15Migrator.Finalizer.Scripts,,,Scripts,Scripts,النصوص البرمجية,Skripte,Scripts,Scripts,स्क्रिप्ट्स,Skrip,Script,スクリプト,스크립트,Skrypty,Scripts,,สคริปต์,Betikler,Kịch Bản,脚本,脚本,指令碼
Studio.R15Migrator.Finalizer.Characters,,,Characters,Characters,الشخصيات,Charaktere,Personajes,Personnages,कैरेक्टर,Karakter,Personaggi,キャラクター,캐릭터,Postacie,Personagens,,ตัวละคร,Karakterler,Nhân Vật,角色,角色,角色
Studio.R15Migrator.Finalizer.Instructions,,,Confirming finalization step is not reversible. Script backup data and any compatability layer instances on converted avatars will be deleted. Below are characters and scripts that have not been converted. Please check this list to make sure everything you need is converted before confirming.,Confirming finalization step is not reversible. Script backup data and any compatability layer instances on converted avatars will be deleted. Below are characters and scripts that have not been converted. Please check this list to make sure everything you need is converted before confirming.,لا يُمكن التراجع عن تأكيد خطوة الإنهاء. سيتم حذف بيانات النسخ الاحتياطي للنصوص البرمجية وأي حالات ضمن طبقة التوافق على الأفاتارات المُحوَّلة. فيما يلي الشخصيات والنصوص البرمجية التي لم يتم تحويلها. يُرجى مراجعة هذه القائمة للتأكد من تحويل كل ما تحتاج إليه قبل التأكيد.,"Das Bestätigen des Abschlussschrittes kann nicht rückgängig gemacht werden. Skript-Backup-Daten und alle Kompatibilitätsebenen-Instanzen auf konvertierten Avataren werden gelöscht. Im Folgenden findest du Charaktere und Skripte, die nicht konvertiert wurden. Bitte überprüfe diese Liste vor dem Bestätigen, um sicherzustellen, dass alles, was du brauchst, konvertiert wurde.",La confirmación del paso de finalización no es reversible. Los datos de copia de seguridad del script y cualquier instancia de capa de compatibilidad en avatares convertidos serán eliminados. A continuación hay personajes y scripts que no se han convertido. Comprueba esta lista para asegurarte de que todo lo que necesitas se convierta antes de confirmar.,La confirmation de l'étape de finalisation n'est pas réversible. Les données de sauvegarde du script et toutes les instances de couche de compatibilité sur les avatars convertis seront supprimées. Voici les caractères et les scripts qui n'ont pas été convertis. Vérifier cette liste pour t'assurer que tout ce dont tu as besoin est converti avant de confirmer.,फ़ाइनल स्टेप कन्फ़र्म करना रिवर्सिबिल नहीं है. स्क्रिप्ट बैकअप डेटा और कन्वर्ट किए गए अवतार पर मौजूद किसी भी कंपैटिबिलिटी लेयर इंस्टैंस को डिलीट कर दिया जाएगा. नीचे ऐसे कैरेक्टर और स्क्रिप्ट दिए गए हैं जिन्हें कन्फ़र्म नहीं किया गया है. कन्फ़र्म करने से पहले कृपया इस लिस्ट को देखें ताकि आप यह पक्का कर सकें कि आपकी ज़रूरत की हर चीज़ कन्फ़र्म हो गई है.,Langkah penyelesaian tidak bisa dikembalikan setelah dikonfirmasi. Data cadangan skrip dan instance layer kompatibilitas apa pun di avatar yang telah dikonversi akan dihapus. Berikut ini adalah karakter dan skrip yang belum dikonversi. Silakan cek daftar ini untuk memastikan semua yang kamu perlukan sudah dikonversi sebelum mengonfirmasi.,"La fase di conferma della finalizzazione non è reversibile. I dati di backup degli script e tutti i livelli di compatibilità creati per gli avatar convertiti saranno eliminati. L'elenco di seguito riporta i personaggi e gli script non convertiti. Prima di confermare, controlla questo elenco per assicurarti che tutto ciò di cui hai bisogno sia stato convertito.",仕上げの手順を確認すると元に戻せません。スクリプトのバックアップデータと変換されたアバター上の任意の互換性レイヤーインスタンスは削除されます。以下は未変換のキャラクターとスクリプトです。確認する前にこのリストをチェックして必要なすべてが変換されていることを確認してください。,완료 단계 확인은 되돌릴 수 없습니다. 변환된 아바타의 스크립트 백업 데이터 및 모든 호환성 레이어 인스턴스가 삭제됩니다. 변환되지 않은 캐릭터 및 스크립트는 아래와 같습니다. 확인하기 전에 이 목록을 확인해 필요한 모든 것의 변환 완료 여부를 점검하세요.,"Potwierdzenia etapu finalizacji nie można cofnąć. Dane kopii zapasowej skryptu oraz instancje warstwy zgodności dotyczące konwertowanych awatarów zostaną usunięte. Poniżej wyszczególniono postacie i skrypty, które nie zostały przekonwertowane. Przed potwierdzeniem sprawdź tę listę, aby upewnić się, że wszystko, co trzeba, zostało przekonwertowane.",A confirmação de finalização de etapa não é reversível. Dados de backup de scripts e quaisquer instâncias de camada de compatibilidade em avatares convertidos serão excluídos. Abaixo estão os caracteres e scripts que não foram convertidos. Verifique a lista para certificar-se de que tudo o que você precisa é convertido antes de confirmar.,,การยืนยันขั้นตอนการสรุปจะไม่สามารถย้อนกลับได้ ข้อมูลสำรองสคริปต์ และอินสแตนซ์ชั้นความเข้ากันได้ทั้งหมดในอวาตาร์ที่แปลงแล้วจะถูกลบออกไป ด้านล่างนี้คือตัวละครและสคริปต์ที่ยังไม่ได้แปลง โปรดตรวจสอบรายการนี้เพื่อให้แน่ใจว่าคุณได้แปลงทุกสิ่งที่คุณต้องการแล้วก่อนที่จะทำการยืนยัน,Sonuçlandırma adımının onaylanması geri alınamaz. Betik yedek verileri ve dönüştürülmüş avatarlardaki tüm uyumluluk katmanı örnekleri silinir. Dönüştürülmemiş karakterleri ve betikleri aşağıda görebilirsin. Lütfen ihtiyacın olan her şeyin dönüştürüldüğünden emin olmak için listeyi kontrol et.,Không thể hoàn lại việc xác nhận bước hoàn tất. Dữ liệu sao lưu kịch bản và mọi đối tượng lớp tương thích trên avatar đã chuyển đổi sẽ bị xóa. Dưới đây là các nhân vật và kịch bản chưa được chuyển đổi. Vui lòng kiểm tra danh sách này để đảm bảo mọi thứ bạn cần đều đã được chuyển đổi trước khi xác nhận.,完结步骤确认后将无法再恢复。脚本备份数据和转换虚拟形象的兼容层实例将被删除。以下是未转换的虚拟形象和脚本。请检查该列表，确保所有需要的内容均已转换再进行确认。,完结步骤确认后将无法再恢复。脚本备份数据和转换虚拟形象的兼容层实例将被删除。以下是未转换的虚拟形象和脚本。请检查该列表，确保所有需要的内容均已转换再进行确认。,確認定案步驟是不可逆的選項。會刪除已轉換虛擬人偶的指令碼備份資料與任何相容性圖層個體。以下是尚未轉換的角色與指令碼。在確認前，請檢查此清單以確保您需要的一切皆已轉換。
Studio.R15Migrator.Finalizer.OK,,,OK,OK,موافق,OK,Aceptar,Ok,ठीक है,OK,OK,了解,확인,OK,OK,,ตกลง,Tamam,OK,好的,好的,確定
Studio.R15Migrator.Finalizer.Confirm,,,Confirm,Confirm,تأكيد,Bestätigen,Confirmar,Confirmer,कन्फ़र्म करें,Konfirmasi,Conferma,確認する,확인,Potwierdź,Confirmar,,ยืนยัน,Onayla,Xác Nhận,确认,确认,確認
Studio.R15Migrator.Finalizer.FinalizedTitle,,,Conversion Complete,Conversion Complete,اكتمل التحويل,Konvertierung abgeschlossen,Conversión completada,Conversion terminée,कन्वर्ज़न पूरा हुआ,Konversi Selesai,Conversione completata,変換完了,변환 완료,Ukończono konwertowanie,Conversão completa,,การแปลงเสร็จสมบูรณ์แล้ว,Dönüştürme tamamlandı,Chuyển Đổi Hoàn Tất,转换完成,转换完成,轉換完成
Studio.R15Migrator.Finalizer.FinalizedDescription,,,Finalization step is complete. Please test your experience.,Finalization step is complete. Please test your experience.,اكتملت خطوة الإنهاء. يُرجى اختبار التجربة.,Der Abschlussschritt ist abgeschlossen. Bitte teste dein Erlebnis.,El paso de finalización terminó. Prueba tu experiencia.,L'étape de finalisation est terminée. Tester ton expérience.,फ़ाइनलाइज़ेशन स्टेप पूरा हो गया है. कृपया अपने एक्सपीरियंस को टेस्ट करें.,Langkah penyelesaian selesai. Harap tes pengalaman virtualmu.,La fase di finalizzazione è completata. Ti invitiamo a testare la tua esperienza.,仕上げの手順が完了しました。バーチャル空間をテストしてください。,완료 단계를 끝냈습니다. 체험을 테스트하세요.,Ukończono etap finalizacji. Przetestuj projekt.,A etapa de finalização está completa. Teste sua experiência.,,ขั้นตอนการสรุปเสร็จสมบูรณ์แล้ว โปรดทดสอบประสบการณ์ของคุณ,Sonuçlandırma adımı tamamlandı. Lütfen deneyimini test et.,Bước hoàn thiện đã xong. Vui lòng thử nghiệm trải nghiệm của bạn.,完结步骤完成。请测试你的作品。,完结步骤完成。请测试你的作品。,定案步驟已完成。請測試您的體驗。
Studio.R15Migrator.Tabs.AdapterPane,,,Adapter,Adapter,المُحول,Adapter,Adaptador,Adaptateur,अडैप्टर,Adaptor,Adattatore,アダプター,어댑터,Adapter,Adaptador,,ตัวปรับ,Uyarlayıcı,Bộ Chuyển Đổi,适配器,适配器,轉換器
Studio.R15Migrator.AdapterPane.AdapterInserted,,,Adapter inserted. [link1],Adapter inserted. [link1],تم إدخال المُحول. [link1],Adapter eingefügt. [link1],Adaptador insertado. [link1],Adaptateur inséré. [link1],अडैप्टर डाला गया. [link1],Adaptor dimasukkan. [link1],Adattatore inserito. [link1],アダプターが挿入されました。 [link1],어댑터가 삽입되었습니다. [link1],Wstawiono adapter. [link1],Adaptador inserido. [link1],,แทรกตัวปรับแล้ว [link1],Uyarlayıcı eklendi. [link1],Đã lắp bộ chuyển đổi. [link1],适配器已插入。[链接 1],适配器已插入。[链接 1],已插入轉換工具。[link1]
Studio.R15Migrator.AdapterPane.AdapterRemoved,,,Adapter removed. [link1],Adapter removed. [link1],تمت إزالة المُحول. [link1],Adapter entfernt. [link1],Adaptador eliminado. [link1],Adaptateur retiré. [link1],अडैप्टर हटाया गया. [link1],Adaptor dihapus. [link1],Adattatore rimosso. [link1],アダプターが削除されました。 [link1],어댑터가 제거되었습니다. [link1],Usunięto adapter. [link1],Adaptador removido. [link1],,ลบตัวปรับแล้ว [link1],Uyarlayıcı kaldırıldı. [link1],Đã bỏ bộ chuyển đổi. [link1],适配器已移除。[链接 1],适配器已移除。[链接 1],已移除轉換工具。[link1]
Studio.R15Migrator.AdapterPane.LearnMore,,,Learn more,Learn more,معرفة المزيد,Mehr erfahren,Aprende más,En apprendre plus,ज़्यादा जानें,Pelajari selengkapnya,Scopri di più,もっと詳しく,자세한 정보,Dowiedz się więcej,Saiba mais,,เรียนรู้เพิ่มเติม,Daha fazla bilgi edin,Tìm hiểu thêm,了解更多,了解更多,深入了解
Studio.R15Migrator.AdapterPane.SeamlessTestingText,,,"With this script inserted, you can seamlessly test a mix of R6 characters alongside R15 characters during the conversion process.","With this script inserted, you can seamlessly test a mix of R6 characters alongside R15 characters during the conversion process.",من خلال إدراج هذا النص البرمجي، يمكنك اختبار مزيج من شخصيات R6 إلى جانب شخصيات R15 بسلاسة أثناء عملية التحويل.,"Wenn du dieses Skript einfügst, kannst du während des Konvertierungsprozesses nahtlos eine Mischung aus R6- und R15-Charakter testen.","Con este script insertado, puedes probar una mezcla de caracteres R6 junto a R15 durante el proceso de conversión.","Avec ce script inséré, tu peux facilement tester un mélange de caractères R6 aux côtés de caractères R15 pendant le processus de conversion.","इस स्क्रिप्ट को इंसर्ट करके, कन्वर्ज़न प्रोसेस के दौरान R15 कैरेक्टर के साथ R6 कैरेक्टर के मिक्स का आसानी से टेस्ट किया जा सकता है.","Dengan memasukkan skrip ini, kamu bisa dengan mulus mengetes kombinasi karakter R6 dan karakter R15 selama proses konversi.","Con questo script inserito, è possibile testare senza problemi un mix di caratteri R6 accanto a caratteri R15 durante il processo di conversione.",このスクリプトを挿入してあると、変換処理でR15のキャラクターとR6のキャラクターを一緒に途切れなくテストできます。,이 스크립트를 삽입하면 변환 프로세스 진행 중에 R15 캐릭터와 R6 캐릭터의 혼합을 원활하게 테스트할 수 있습니다.,"Po wstawieniu tego skryptu możesz bez problemów przetestować wersję zawierającą zarówno postacie R6, jak i postacie R15 w trakcie konwertowania.","Com este script inserido, você pode testar uma mistura de caracteres R6 ao lado de caracteres R15 durante o processo de conversão.",,หากแทรกสคริปต์นี้ คุณจะสามารถทดสอบการผสมผสานระหว่างตัวละคร R6 ไปพร้อมกับตัวละคร R15 ในระหว่างกระบวนการแปลงได้อย่างราบรื่น,Bu betik eklendiğinde dönüştürme sürecinde R6 karakterleri R15 karakterlerle birlikte sorunsuzca test edebilirsin.,"Khi chèn kịch bản này, bạn có thể dễ dàng thử nghiệm sự kết hợp giữa các nhân vật R6 với các nhân vật R15 trong quá trình chuyển đổi.",插入此脚本后，你可以在转换过程中流畅测试 R6 字符和 R15 字符。,插入此脚本后，你可以在转换过程中流畅测试 R6 字符和 R15 字符。,插入此指令碼後，您可以在轉換過程中對混合了 R6 角色與 R15 角色的內容進行測試。
Studio.R15Migrator.AdapterPane.FindRemainingCharactersText,,,"With this Script removed, unconverted R6 characters will appear broken. This can be a good way to find any remaining characters and Scripts that need conversion.","With this Script removed, unconverted R6 characters will appear broken. This can be a good way to find any remaining characters and Scripts that need conversion.",عند إزالة هذا النص البرمجي، ستظهر شخصيات R6 غير المُحوَّلة معطلة. قد تكون هذه طريقة جيدة للعثور على أي شخصيات ونصوص برمجية متبقية تحتاج إلى تحويل.,"Wenn du das Skript entfernst, erscheinen nicht umgewandelte R6-Charaktere fehlerhaft. Auf diese Weise kannst du leicht herausfinden, welche Charaktere und Skripte noch umgewandelt werden müssen.","Con este script eliminado, los caracteres R6 no convertidos aparecerán dañados. Esta puede ser una buena manera de encontrar cualquier carácter y scripts restantes que necesiten conversión.","Avec ce script supprimé, les caractères R6 non convertis apparaîtront brisés. Cela peut être un bon moyen de trouver les caractères et les scripts qui ont besoin d'être convertis.","इस स्क्रिप्ट को हटाने के साथ, कन्वर्ट नहीं किए गए R6 कैरेक्टर टूटे हुए दिखाई देंगे. कन्वर्ज़न की ज़रूरत वाले किसी भी शेष कैरेक्टर और स्क्रिप्ट को खोजने का यह एक अच्छा तरीका हो सकता है.","Jika Skrip ini dihapus, karakter R6 yang belum dikonversi akan tampak rusak. Ini dapat menjadi cara yang baik untuk menemukan karakter dan Skrip yang masih harus dikonversi.","Con questo Script rimosso, i caratteri R6 non convertiti appariranno rotti. Questo può essere un buon modo per trovare tutti i caratteri rimanenti e script che hanno bisogno di conversione.",このスクリプトが削除してあると、変換されていないR6キャラクターが壊れて表示されます。 これは、変換が必要な残りのキャラクターやスクリプトを見つけるのに適切な方法です。,이 스크립트를 제거하면 변환되지 않은 R6 캐릭터가 깨져서 나타납니다. 이는 변환이 필요한 나머지 캐릭터와 스크립트를 찾는 좋은 방법이 될 수 있습니다.,"Po usunięciu tego skryptu nieprzekonwertowane postacie R6 będą widoczne jako uszkodzone. Może to być dobry sposób na wykrycie pozostałych postaci i skryptów, które wymagają przekonwertowania.","Com este script removido, caracteres R6 não convertidos aparecerão quebrados. Esta pode ser uma boa maneira de encontrar quaisquer caracteres e scripts restantes que precisam de conversão.",,หากลบสคริปต์นี้ ตัวละคร R6 ที่ยังไม่ได้แปลงจะเกิดการชำรุด การดำเนินการนี้เป็นวิธีที่ดีในการค้นหาตัวละครและสคริปต์ที่จำเป็นต้องได้รับการแปลงซึ่งยังคงหลงเหลืออยู่,Bu betik kaldırıldığında dönüştürülmemiş R6 karakterleri bozuk görünür. Bunu dönüştürülmesi gereken karakterleri ve betikleri görmek için kullanabilirsin.,"Khi bỏ Kịch Bản này, các nhân vật R6 chưa chuyển đổi sẽ bị lỗi. Đây có thể là một cách hay để tìm các nhân vật và Kịch Bản còn lại cần chuyển đổi.",移除此脚本后，未经转换的 R6 字符将显示为破碎字符。此法可以有效找出所有剩余需要转换的字符和脚本。,移除此脚本后，未经转换的 R6 字符将显示为破碎字符。此法可以有效找出所有剩余需要转换的字符和脚本。,移除此指令碼後，未轉換的 R6 角色將顯示為無效。這能幫助您尋找是否有其餘需要轉換的角色和指令碼。
Studio.R15Migrator.AdapterPane.RemovalHeaderText,,,Remove before Publishing,Remove before Publishing,الإزالة قبل النشر,Vor der Veröffentlichung entfernen,Eliminar antes de publicar,Supprimer avant de publier,पब्लिश करने से पहले हटाएँ,Hapus sebelum Publikasi,Rimuovi prima della pubblicazione,公開前に削除,게시하기 전에 제거하세요,Usuń przed opublikowaniem,Remover antes de publicar,,ลบก่อนการเผยแพร่,Yayınlamadan önce kaldır,Bỏ trước khi Đăng,发布前移除,发布前移除,移除後發佈
Studio.R15Migrator.AdapterPane.RemovalText,,,"Prior to publishing your experience, you are required to remove the adapter","Prior to publishing your experience, you are required to remove the adapter",قبل نشر التجربة، يجب عليك إزالة المُحول,"Bevor du dein Erlebnis veröffentlichst, musst du den Adapter entfernen","Antes de publicar tu experiencia, debes quitar el adaptador","Avant de publier ton expérience, tu dois retirer l'adaptateur","अपना एक्सपीरियंस पब्लिश करने से पहले, आपको अडैप्टर को हटाना होगा","Sebelum memublikasikan pengalaman virtualmu, kamu harus menghapus adaptor","Prima di pubblicare la tua esperienza, devi rimuovere l'adattatore",バーチャル空間を公開する前にアダプターを取り外す必要があります,체험을 게시하기 전에 어댑터를 제거해야 합니다,Przed opublikowaniem projektu konieczne będzie usunięcie tego adaptera,"Antes de publicar sua experiência, você deve remover o adaptador",,ก่อนที่จะเผยแพร่ประสบการณ์ของคุณ คุณต้องลบตัวปรับก่อน,Deneyimini yayınlamadan önce adaptörü kaldırman gerekir,"Trước khi phát hành trải nghiệm, bạn cần phải bỏ bộ chuyển đổi",发布体验之前，你需要先移除适配器,发布体验之前，你需要先移除适配器,發佈體驗前，您需要移除轉換工具
