Key,Context,Example,Source,en-us,ar-001,de-de,es-es,fr-fr,hi-in,id-id,it-it,ja-jp,ko-kr,pl-pl,pt-br,ru-ru,th-th,tr-tr,vi-vn,zh-cjv,zh-cn,zh-tw
Studio.StyleEditor.Plugin.Name,,,Style Editor,Style Editor,محرر النمط,Style-Editor,Editor de estilos,Éditeur de style,स्टाइल एडिटर,Editor Gaya,Editor di stile,スタイル編集,스타일 편집기,Edytor stylów,Editor de estilo,,เครื่องมือแก้ไขรูปแบบ,Stil Düzenleyici,Trình Chỉnh Sửa Kiểu,样式编辑器,样式编辑器,風格編輯器
Studio.StyleEditor.Plugin.Toolbar,,,Style Editor,Style Editor,محرر النمط,Style-Editor,Editor de estilos,Éditeur de style,स्टाइल एडिटर,Editor Gaya,Editor di stile,スタイル編集,스타일 편집기,Edytor stylów,Editor de estilo,,เครื่องมือแก้ไขรูปแบบ,Stil Düzenleyici,Trình Chỉnh Sửa Kiểu,样式编辑器,样式编辑器,風格編輯器
Studio.StyleEditor.Plugin.Button,,,Style Editor,Style Editor,محرر النمط,Style-Editor,Editor de estilos,Éditeur de style,स्टाइल एडिटर,Editor Gaya,Editor di stile,スタイル編集,스타일 편집기,Edytor stylów,Editor de estilo,,เครื่องมือแก้ไขรูปแบบ,Stil Düzenleyici,Trình Chỉnh Sửa Kiểu,样式编辑器,样式编辑器,風格編輯器
Studio.StyleEditor.Plugin.Description,,,Toggle the Style Editor.,Toggle the Style Editor.,تبديل محرر النمط.,Schalte den Stil-Editor um.,Alternar Editor de estilos,Activer/désactiver l'éditeur de style.,स्टाइल एडिटर को टॉगल करें.,Menyalakan/Mematikan Editor Gaya.,Attiva/disattiva l'editor di stile.,スタイル編集を切りかえ。,스타일 편집기를 토글합니다.,Włącz/wyłącz edytor stylów.,Alternar o Editor de estilo.,,เปิด/ปิดเครื่องมือแก้ไขรูปแบบ,Stil Düzenleyici'yi açıp kapatır.,Bật/tắt Trình Chỉnh Sửa Kiểu.,切换风格编辑器。,切换风格编辑器。,切換風格編輯器。
Studio.StyleEditor.Plugin.Text,,,Example Text!,Example Text!,نص اختباري كمثال!,Beispieltext!,Texto de ejemplo,Exemple de texte !,उदाहरण टेक्स्ट!,Teks Contoh!,Testo di esempio!,テキストの例！,예시 텍스트!,Tekst przykładowy!,Texto de exemplo!,,ข้อความตัวอย่าง!,Örnek Metin!,Văn Bản Mẫu!,示例文本！,示例文本！,範例文字！
Studio.StyleEditor.Onboarding.Title,,,Style Editor,Style Editor,محرر النمط,Style-Editor,Editor de estilos,Éditeur de style,स्टाइल एडिटर,Editor Gaya,Editor di stile,スタイル編集,스타일 편집기,Edytor stylów,Editor de estilo,,เครื่องมือแก้ไขรูปแบบ,Stil Düzenleyici,Trình Chỉnh Sửa Kiểu,样式编辑器,样式编辑器,風格編輯器
Studio.StyleEditor.Onboarding.StartFromExample,,,Start from Example,Start from Example,البدء من المثال,Von Beispiel starten,Comenzar desde ejemplo,Commencer à partir d'un exemple,उदाहरण से शुरू करें,Mulai dari Contoh,Inizia da un esempio,例を使って開始,예시로 시작,Zacznij od przykładu,Comece a partir de um exemplo,,เริ่มต้นจากตัวอย่าง,Örnekten başla,Bắt Đầu từ Ví Dụ,从示例开始,从示例开始,從範例開始
Studio.StyleEditor.Onboarding.StartBlank,,,New Blank Design,New Blank Design,تصميم فارغ جديد,Neues leeres Design,Nuevo diseño en blanco,Nouveau design vierge,नया ब्लैंक डिज़ाइन,Desain Kosong Baru,Nuovo design vuoto,新規（空白）デザイン,새 공백 디자인,Nowy pusty projekt,Novo design em branco,,การออกแบบว่างเปล่ารายการใหม่,Yeni boş tasarım,Thiết Kế Trống Mới,全新留白设计,全新留白设计,新的空白設計
Studio.StyleEditor.Onboarding.LearnMore,,,Learn More,Learn More,معرفة المزيد,Mehr erfahren,Aprende más,En savoir plus,ज़्यादा जानें,Pelajari Selengkapnya,Maggiori informazioni,もっと詳しく,자세한 정보,Dowiedz się więcej,Saiba mais,,เรียนรู้เพิ่มเติม,Daha fazla bilgi edin,Tìm Hiểu Thêm,了解更多,了解更多,深入了解
Studio.StyleEditor.Onboarding.Description,,,The Style Editor is a way to manage styles and themes. Create global styles for UI elements and change them from one location. Instantly change your UI theme with a button press.,The Style Editor is a way to manage styles and themes. Create global styles for UI elements and change them from one location. Instantly change your UI theme with a button press.,محرر النمط هو طريقة لإدارة الأنماط والقوالب. أنشئ أنماطًا عالمية لعناصر واجهة المستخدم وقم بتغييرها من موقع واحد. قم بتغيير قالب واجهة المستخدم الخاص بك على الفور بضغطة زر.,"Der Style-Editor ist eine Möglichkeit, Stile und Themen zu verwalten. Erstelle globale Stile für UI-Elemente und ändere diese von einem zentralen Ort aus. Ändere dein UI-Thema mit nur einem Tastendruck.",El Editor de estilos es una forma de administrar estilos y temas. Crea estilos globales para elementos de interfaz de usuario y cámbielos desde una ubicación. Cambia instantáneamente tu tema de interfaz de usuario presionando un botón.,L'éditeur de style permet de gérer les styles et les thèmes. Crée des styles globaux pour les éléments de l'interface utilisateur et modifie-les à partir d'un seul endroit. Change instantanément le thème de ton interface utilisateur en appuyant sur un bouton.,स्टाइल एडिटर स्टाइल और थीम मैनेज करने का एक तरीका है. UI एलिमेंट्स के लिए ग्लोबल स्टाइल बनाएँ और उन्हें एक लोकेशन से बदलें. एक बटन दबाकर तुरंत अपने UI की थीम बदलें.,Editor Gaya adalah cara untuk mengelola gaya dan tema. Buat gaya global untuk elemen UI dan ubah gaya dari satu tempat. Ubah langsung tema UI hanya dengan menekan satu tombol.,"L'Editor di stile ti permette di gestire stili e temi. Qui puoi creare e modificare tutti gli stili per gli elementi dell'interfaccia, e persino modificare all'istante il tema dell'interfaccia utente premendo un pulsante.",スタイル編集を使うと書式とテーマを管理できます。 UI要素のグローバル書式を作成して1ヶ所で変更します。ボタンを押せばすぐにUIテーマを変更できます。,스타일 편집기를 이용하면 스타일과 테마를 관리할 수 있습니다. UI 요소의 전역 스타일을 생성하고 한 곳에서 변경하세요. 버튼을 누르면 UI 테마를 즉시 변경할 수 있습니다.,Edytor stylów umożliwia zarządzanie stylami i motywami. W jednej lokalizacji możesz tworzyć style globalne dla elementów interfejsu użytkownika i zmieniać je. Możesz błyskawicznie zmienić motyw interfejsu użytkownika za naciśnięciem przycisku.,O Editor de estilo é uma maneira de gerenciar estilos e temas. Crie estilos globais para elementos da interface do usuário e altere-os a partir de um único local. Altere instantaneamente seu tema da interface do usuário com um toque de botão.,,เครื่องมือแก้ไขรูปแบบเป็นวิธีในการจัดการรูปแบบและธีม สร้างรูปแบบสากลสำหรับองค์ประกอบ UI และเปลี่ยนแปลงจากตำแหน่งเดียว เปลี่ยนแปลงธีม UI ของคุณได้ในทันทีด้วยการกดปุ่มเพียงครั้งเดียว,"Biçim Düzenleyici, biçimleri ve temaları yönetmeye yarar. Kullanıcı arayüzü unsurları için genel biçimler oluşturup bu biçimleri tek bir yerden değiştirebilirsin. Kullanıcı arayüzü temanı tek bir düğmeyle anında değiştir.","Trình Chỉnh Sửa Kiểu là một công cụ quản lý các kiểu dáng và chủ đề. Bạn có thể tạo ra các kiểu dáng phổ biến cho các yếu tố UI và thay đổi chúng chỉ từ một địa điểm. Thậm chí, bạn còn có thể thay đổi ngay chủ đề UI chỉ với một nút bấm.",样式编辑器可以用于管理样式和主题。为 UI 元素创建全局样式，在一个位置上对其进行更改。按下按钮即可立即更改 UI 主题。,样式编辑器可以用于管理样式和主题。为 UI 元素创建全局样式，在一个位置上对其进行更改。按下按钮即可立即更改 UI 主题。,風格編輯器可用來管理風格和主題。您可在同一個位置建立 UI 元素的全域樣式並進行變更。按下一個按鈕即可立即變更 UI 主題。
Studio.StyleEditor.ContextMenu.New.PseudoInstance,,,Pseudo Instance,Pseudo Instance,حالة زائفة,Pseudoinstanz,Pseudoinstancia,Pseudo Instance,सूडो इंस्टैंस,Pseudo Instance,Pseudo istanza,擬似インスタンス,모의 인스턴스,Pseudoinstancja,Pseudoinstância,,อินสแตนซ์เทียม,Sözde Örnek,Đối Tượng Giả,伪实例,伪实例,虛擬個體
Studio.StyleEditor.ContextMenu.Rename,,,Rename,Rename,إعادة التسمية,Umbenennen,Cambiar nombre,Renommer,नाम बदलें,Ubah Nama,Rinomina,名前の変更,이름 바꾸기,Zmień nazwę,Renomear,,เปลี่ยนชื่อ,Yeniden adlandır,Đổi Tên,重命名,重命名,重新命名
Studio.StyleEditor.Label.TokenErrorIncorrectType,,,Error: incorrect token type (expected '{expectedType}' but got '{actualType}'),Error: incorrect token type (expected '{expectedType}' but got '{actualType}'),خطأ: نوع التوكن غير صحيح (متوقع '{expectedType}' ولكن تم الحصول على '{actualType}'),"Fehler: falscher Token-Typ ({expectedType} erwartet, aber {actualType} erhalten)",Error: tipo de token incorrecto (se esperaba '{expectedType}' pero se obtuvo '{actualType}'),Erreur : type de token incorrect (attendu '{expectedType}' mais obtenu '{actualType}'),"गड़बड़ी : टोकन का टाइप गलत है ('{expectedType}' होना चाहिए था, लेकिन '{actualType}' मिला)",Eror: tipe token salah (diharapkan '{expectedType}' tetapi menerima '{actualType}'),"Errore: il tipo di token è errato (il tipo previsto era ""{expectedType}"", ma è stato ottenuto ""{actualType}"")",エラー: トークンタイプが間違っています（ 「{expectedType}」が求められていますが「{actualType}」でした）,오류: 토큰 유형이 잘못되었습니다('{expectedType}'(이)가 요청되었으나 '{actualType}'(을)를 받음),"Błąd: nieprawidłowy typ tokenu (oczekiwano typu „{expectedType}”, ale uzyskano typ „{actualType}”)",Erro: tipo de token incorreto (esperado '{expectedType}' mas obteve '{actualType}'),,ข้อผิดพลาด: ประเภทโทเค็นไม่ถูกต้อง (ที่คาดหวัง '{expectedType}' แต่มี '{actualType}'),"Hata: Jeton türü yanlış (""{expectedType}"" beklenirken ""{actualType}"" alındı)","Lỗi: loại token không chính xác (mong chờ ""{expectedType}"" nhưng nhận được ""{actualType}"")",错误：令牌类型不正确（要求类型为“{expectedType}”，实际类型为“{actualType}”）,错误：令牌类型不正确（要求类型为“{expectedType}”，实际类型为“{actualType}”）,錯誤：不正確的標記類型（應為「{expectedType}」但取得「{actualType}」）
Studio.StyleEditor.ContextMenu.New.Child,,,Child,Child,فرعي,Untergeordnetes Element,Hijo,Enfant,चाइल्ड,Anak,Figlio,子,자식,Element potomny,Filho,,รายการย่อย,Alt öğe,Trẻ Em,子级,子级,子
Studio.StyleEditor.Category.UiElements,,,UI Elements,UI Elements,عناصر واجهة المستخدم,UI-Elemente,Elementos de la interfaz,Éléments d'interface,UI एलिमेंट्स,Elemen UI,Elementi dell'interfaccia utente,UI要素,UI 요소,Elementy interfejsu,Elementos de interface do usuário,,องค์ประกอบ UI,UI Unsurları,Yếu tố UI,UI 元素,UI 元素,UI 元素
Studio.StyleEditor.ContextMenu.New.Tag,,,Tag,Tag,العلامة,Tag,Etiqueta,Tag,टैग,Tag,Tag,タグ,태그,Tagi,Marcador,,แท็ก,Etiket,Thẻ,标记,标记,標籤
Studio.StyleEditor.Control.SearchPlaceholder,,,Search,Search,بحث,Suchen,Buscar,Recherche,सर्च करें,Cari,Cerca,サーチ,검색,Wyszukaj,Pesquisar,,ค้นหา,Ara,Tìm Kiếm,搜索,搜索,搜尋
Studio.StyleEditor.Label.TokenErrorDoesNotExist,,,Error: token does not exist,Error: token does not exist,خطأ: التوكن غير موجود,Fehler: Token existiert nicht,Error: el token no existe,Erreur : le token n'existe pas,गड़बड़ी : टोकन मौजूद नहीं है,Eror: token tidak ada,Errore: il token non esiste,エラー: トークンが存在しません,오류: 토큰이 존재하지 않음,Błąd: token nie istnieje,Erro: token não existe,,ข้อผิดพลาด: ไม่มีโทเค็นนี้อยู่,Hata: Jeton mevcut değil,Lỗi: token không tồn tại,错误：令牌不存在,错误：令牌不存在,錯誤：標記不存在
Studio.StyleEditor.ContextMenu.SetCategory,,,Set Category,Set Category,تعيين فئة,Kategorie festlegen,Establecer categoría,Définir la catégorie,कैटगरी सेट करें,Atur Kategori,Imposta categoria,カテゴリを設定,카테고리 설정,Ustaw kategorię,Definir categoria,,กำหนดหมวดหมู่,Kategori ayarla,Đặt Thể Loại,设置类别,设置类别,設定類別
Studio.StyleEditor.ContextMenu.ViewTheme,,,View Theme,View Theme,عرض السمة,Thema ansehen,Ver tema,Afficher le thème,थीम देखें,Lihat Tema,Visualizza tema,テーマを表示,테마 보기,Wyświetl motyw,Ver tema,,ดูธีม,Temayı görüntüle,Xem Chủ Đề,查看主题,查看主题,檢視主題
Studio.StyleEditor.Category.Size,,,Size,Size,الحجم,Größe,Tamaño,Taille,साइज़,Ukuran,Dimensione,サイズ,크기,Wielkość,Tamanho,,ขนาด,Boyut,Kích Thước,尺寸,尺寸,大小
Studio.StyleEditor.Table.CellPlaceholder,,,Add a {type}...,Add a {type}...,إضافة {type}...,{type} hinzufügen …,Añade {type}...,Ajouter un(e) {type}...,{type} जोड़ें...,Tambahkan {type}...,Aggiungi {type}...,{type} を追加...,{type} 추가...,Dodaj typ {type}...,Adicione um {type}...,,เพิ่ม{type}...,Bir {type} ekle...,Thêm một {type}...,添加一个 {type}……,添加一个 {type}……,新增一個{type}……
Studio.StyleEditor.Label.TokenErrorUnknown,,,Error: unknown,Error: unknown,خطأ: غير معروف,Fehler: unbekannt,Error: desconocido,Erreur : inconnue,गड़बड़ी : अज्ञात,Eror: tidak diketahui,Errore: sconosciuto,エラー: 不明,오류: 알 수 없음,Błąd: nieznany,Erro: desconhecido,,ข้อผิดพลาด: ไม่สามารถระบุได้,Hata: Bilinmiyor,Lỗi: không xác định,错误：未知,错误：未知,錯誤：未知
Studio.StyleEditor.Control.ApplyBtn.TooltipRemoveTag,,,Remove tag from selected instance(s),Remove tag from selected instance(s),إزالة العلامة من الحالة (الحالات) المحددة,Tag von ausgewählten Instanzen entfernen,Eliminar etiqueta de las instancias seleccionadas,Retirer le tag des instances sélectionnées,चुने गए इंस्टैंस से टैग हटाएँ,Hapus tag dari instance yang dipilih,Rimuovi tag dalle istanze selezionate,選択したインスタンスからタグを削除,선택한 인스턴스에서 태그 제거,Usuń tag z zaznaczonych instancji,Remover marcador das instâncias selecionadas,,ลบแท็กจากอินสแตนซ์ที่เลือก,Etiketi seçili örneklerden kaldır,Bỏ thẻ khỏi (các) đối tượng đã chọn,在选定实例中移除标记,在选定实例中移除标记,移除所選個體的標籤
Studio.StyleEditor.Label.Envelope,,,Envelope,Envelope,ظرف,Hüllkurve,Sobre,Enveloppe,एनवेलप,Amplop,Involucro,エンベロープ,봉투,Obwiednia,Envelope,,ซองจดหมาย,Zarf,Phong Bì,边距范围,边距范围,包絡
Studio.StyleEditor.ContextMenu.Remove,,,Remove,Remove,إزالة,Entfernen,Eliminar,Supprimer,हटाएँ,Hapus,Rimuovi,削除,제거,Usuń,Remover,,ลบ,Kaldır,Bỏ,移除,移除,移除
Studio.StyleEditor.Control.ApplyBtn.TextRemoveTag,,,Remove Tag,Remove Tag,إزالة العلامة,Tag entfernen,Eliminar etiqueta,Supprimer le tag,टैग हटाएँ,Hapus Tag,Rimuovi tag,タグを削除,태그 제거,Usuń tag,Remover marcador,,ลบแท็ก,Etiketi kaldır,Bỏ Thẻ,移除标记,移除标记,移除標籤
Studio.StyleEditor.Label.Time,,,Time,Time,الوقت,Zeit,Tiempo/Hora,Heure,समय,Waktu,Ora,時間,시간,Czas,Hora,,เวลา,Zaman,Thời Gian,时间,时间,時間
Studio.StyleEditor.ContextMenu.Duplicate,,,Duplicate,Duplicate,تكرار,Duplizieren,Duplicar,Dupliquer,डुप्लिकेट,Duplikat,Duplica,複製,복제,Powiel,Duplicar,,ทำซ้ำ,Çoğalt,Sao Chép,重复,重复,複製
Studio.StyleEditor.ContextMenu.Copy,,,Copy,Copy,نسخ,Kopieren,Copiar,Copier,कॉपी करें,Salin,Copia,コピー,복사,Skopiuj,Copiar,,คัดลอก,Kopyala,Sao Chép,复制,复制,複製
Studio.StyleEditor.ContextMenu.New.Empty,,,Empty,Empty,فارغ,Leer,Vacío,Vide,खाली,Kosong,Vuoto,空,비우기,Puste,Vazio,,ว่างเปล่า,Boş,Trống,空白,空白,空白
Studio.StyleEditor.ContextMenu.Paste,,,Paste,Paste,لصق,Einfügen,Pegar,Coller,पेस्ट करें,Tempel,Incolla,貼り付け,붙여넣기,Wklej,Colar,,วาง,Yapıştır,Dán,粘贴,粘贴,貼上
Studio.StyleEditor.ContextMenu.UnlinkToken,,,Unlink Token,Unlink Token,إلغاء ربط التوكن,Token-Verknüpfung trennen,Desvincular token,Enlever le token,टोकन को अनलिंक करें,Batalkan Tautan Token,Scollega token,トークンのリンクを解除,토큰 연결 해제,Rozłącz token,Desvincular token,,ยกเลิกการเชื่อมโยงโทเค็น,Jeton bağlantısını kaldır,Hủy Liên Kết Token,取消关联令牌,取消关联令牌,取消連結標記
Studio.StyleEditor.Category.Themes,,,Themes,Themes,الموضوعات,Themen,Temas,Thèmes,थीम,Tema,Temi,テーマ,테마,Motywy,Temas,,ธีม,Temalar,Chủ Đề,主题,主题,主題
Studio.StyleEditor.Control.ApplyBtn.TextApplyTag,,,Apply Tag,Apply Tag,تطبيق العلامة,Tag anwenden,Aplicar etiqueta,Appliquer le tag,टैग अप्लाई करें,Terapkan Tag,Applica tag,タグを適用,태그 적용,Zastosuj tag,Aplicar marcador,,ปรับใช้แท็ก,Etiketi uygula,Áp Dụng Thẻ,应用标记,应用标记,套用標籤
Studio.StyleEditor.Control.Active,,,Active,Active,نشط,Aktiv,Activo,Actif,ऐक्टिव,Aktif,Attiva,アクティブ,활성,Aktywny,Ativo,,ใช้งานอยู่,Etkin,Đang Hoạt Động,活跃,活跃,啟用
Studio.StyleEditor.Label.TokenErrorCyclicReference,,,Error: token references cannot contain cycles,Error: token references cannot contain cycles,خطأ: لا يمكن أن تحتوي مراجع التوكن على دورات,Fehler: Token-Referenzen dürfen keine Zyklen enthalten,Error: las referencias de token no pueden contener ciclos,Erreur : les références des tokens ne peuvent pas contenir de cycles,गड़बड़ी : टोकन रेफ़रेंस में साइकल नहीं हो सकते,Eror: referensi token tidak boleh berisi siklus,Errore: i riferimenti dei token non possono contenere cicli,エラー: トークン参照にはサイクルは入れられません,오류: 토큰 참조에는 주기가 포함될 수 없습니다,Błąd: odwołania do tokenów nie mogą być odwołaniami cyklicznymi,Erro: as referências de token não podem conter ciclos,,ข้อผิดพลาด: การอ้างอิงโทเค็นไม่สามารถมีวงจรได้,Hata: Jeton referansları döngü içeremez,Lỗi: các tham chiếu token không thể chứa chu kỳ,错误：令牌引用不得包含循环,错误：令牌引用不得包含循环,錯誤：標記參照不可包含循環
Studio.StyleEditor.ContextMenu.LinkToken,,,Link Token,Link Token,ربط التوكن,Token verknüpfen,Vincular token,Lien token,टोकन को लिंक करें,Tautkan Token,Collega token,トークンをリンク,토큰 연결,Połącz token,Vincular token,,เชื่อมโยงโทเค็น,Jeton bağla,Liên Kết Token,关联令牌,关联令牌,連結標記
Studio.StyleEditor.Control.Preview,,,Preview,Preview,معاينة,Vorschau,Vista previa,Prévisualiser,प्रीव्यू,Preview,Anteprima,プレビュー,미리 보기,Podgląd,Prévia,,ดูตัวอย่าง,Ön İzleme,Xem Trước,预览,预览,預覽
Studio.StyleEditor.Label.TokenDefinedIn,,,Defined in,Defined in,محدد في,Definiert in,Definido en,Défini dans,इसमें डिफ़ाइन किया गया,Didefinisikan di,Definito in,以下で定義:,다음에 정의됨:,Zdefiniowano w,Definido em,,กำหนดแล้วใน,Şurada tanımlı:,Định nghĩa trong,定义的位置,定义的位置,定義位置：
Studio.StyleEditor.Control.DeleteTooltip,,,Delete,Delete,حذف,Löschen,Eliminar,Supprimer,डिलीट करें,Hapus,Elimina,削除,삭제,Usuń,Excluir,,ลบ,Sil,Xóa,删除,删除,刪除
Studio.StyleEditor.Control.ApplyBtn.TextMixedTag,,,Mixed,Mixed,مختلط,Gemischt,Mezclado,Mélangé,मिला-जुला,Campuran,Misto,ミックス,혼합,Mieszany,Misturado,,ผสมแล้ว,Karışık,Kết Hợp,混合,混合,混合
Studio.StyleEditor.ContextMenu.New,,,New,New,جديد,Neu,Nuevo,Nouveau,नया,Baru,Novità,新規,신규,Nowe,Novo,,ใหม่,Yeni,Mới,新建,新建,全新
Studio.StyleEditor.Table.SelectPlaceholder,,,Select a {type}...,Select a {type}...,تحديد {type}...,{type} auswählen …,Selecciona {type}...,Sélectionner un(e) {type}...,{type} चुनें...,Pilih {type}...,Seleziona {type}...,{type} を選択...,{type} 선택...,Zaznacz typ {type}...,Selecione um {type}...,,เลือก{type}...,Bir {type} seç...,Chọn một {type}...,选择一个 {type}……,选择一个 {type}……,選擇一個{type}……
Studio.StyleEditor.ContextMenu.New.Name,,,Name,Name,الاسم,Name,Nombre,Nom,नाम,Nama,Nome,名前,이름,Nazwa,Nome,,ชื่อ,Ad,Tên,名称,名称,名稱
Studio.StyleEditor.ContextMenu.ShowInExplorer,,,Show in Explorer,Show in Explorer,عرض في المتصفح,Im Explorer anzeigen,Mostrar en Explorador,Afficher dans Explorer,एक्सप्लोरर में दिखाएँ,Tampilkan di Eksplorer,Mostra nell'Esploratore,エクスプローラで表示,탐색기에서 표시,Pokaż w eksploratorze,Mostrar no Explorador,,แสดงในการสำรวจ,Gezgin'de göster,Hiển thị trong Cửa Sổ Khám Phá,在浏览器中显示,在浏览器中显示,在總管中顯示
Studio.StyleEditor.ContextMenu.New.Class,,,Class,Class,الفئة,Klasse,Clase,Classe,क्लास,Kelas,Classe,クラス,클래스,Klasa,Classe,,Class,Sınıf,Lớp,类别,类别,類別
Studio.StyleEditor.ContextMenu.RemoveFromCategory,,,Remove From Category,Remove From Category,إزالة من الفئة,Aus Kategorie entfernen,Eliminar de categoría,Supprimer de la catégorie,कैटगरी से हटाएँ,Hapus dari Kategori,Rimuovi dalla categoria,カテゴリから削除,카테고리에서 제거,Usuń z kategorii,Remover da categoria,,ลบออกจากหมวดหมู่,Kategoriden kaldır,Bỏ Khỏi Thể Loại,从类别中移除,从类别中移除,從類別中移除
Studio.StyleEditor.Category.Tokens,,,Tokens,Tokens,رموز التوكن,Token,Tokens,Tokens,टोकन,Token,Token,トークン,토큰,Tokeny,Tokens,,โทเค็น,Jetonlar,Token,令牌,令牌,標記
Studio.StyleEditor.ContextMenu.New.GuiState,,,GuiState,GuiState,GuiState,GuiState,GuiState,GuiState,GuiState,GuiState,GuiState,GuiState,GuiState,GuiState,GuiState,,GuiState,GuiState,GuiState,GuiState 修改器,GuiState 修改器,GuiState
Studio.StyleEditor.ContextMenu.New.Descendant,,,Descendant,Descendant,تابع,Nachfolger,Descendente,Descendant,डिसेंडेंट,Descendant,Discendente,子孫,하위 항목,Element podrzędny,Descendente,,Descendant,Alt,Đối Tượng Hậu Duệ,后代,后代,子系
Studio.StyleEditor.Control.InsertStyleLink,,,Insert Design StyleLink,Insert Design StyleLink,إدراج تصميم StyleLink,StyleLink-Design einfügen,Insertar StyleLink de diseño,Insérer design StyleLink,डिज़ाइन StyleLink डालें,Masukkan StyleLink Desain,Inserisci StyleLink del design,デザイン StyleLink を挿入,디자인 StyleLink 삽입,Wstaw StyleLink projektu,Inserir design de StyleLink,,แทรก StyleLink การออกแบบ,Tasarım StyleLink'i ekle,Chèn StyleLink Thiết Kế,插入设计样式链接,插入设计样式链接,插入設計 StyleLink
