Key,Context,Example,Source,en-us,ar-001,de-de,es-es,fr-fr,hi-in,id-id,it-it,ja-jp,ko-kr,pl-pl,pt-br,ru-ru,th-th,tr-tr,vi-vn,zh-cjv,zh-cn,zh-tw
Studio.R15Migrator.AnimationStatus.FailedWithErrorCode,,,Upload failed: HTTP error code %d,Upload failed: HTTP error code %d,تعذَّر الرفع: كود خطأ HTTP %d,Upload fehlgeschlagen: HTTP-Fehlercode %d,Error en la carga: código de error HTTP %d,Échec du téléchargement: code d'erreur HTTP %d,अपलोड नहीं किया जा सका : HTTP गड़बड़ी कोड %d,Upload gagal: kode eror HTTP %d,Caricamento non riuscito: codice di errore HTTP %d,アップロードできませんでした: HTTPエラーコード %d,업로드 실패: HTTP 오류 코드 %d,Błąd przesyłania: kod błędu HTTP %d,Falha no upload: código de erro HTTP %d,,อัปโหลดไม่สำเร็จ: รหัสข้อผิดพลาด HTTP %d,Yükleme başarısız: HTTP hata kodu %d,Tải lên không thành công: Mã lỗi HTTP %d,上传失败：HTTP 错误代码 %d,上传失败：HTTP 错误代码 %d,上傳失敗：HTTP 錯誤代碼 %d
Studio.R15Migrator.AnimationStatus.Done,,,Animation has been replaced successfully,Animation has been replaced successfully,تم استبدال الحركة بنجاح,Animation wurde erfolgreich ersetzt,La animación se reemplazó correctamente,Animation remplacée avec succès,ऐनिमेशन बदला जा चुका है,Animasi telah berhasil diganti,L'animazione è stata sostituita correttamente,アニメーションの置き換え完了,애니메이션 바꾸기를 완료했습니다,Animacja została zamieniona,A animação foi substituída com sucesso,,แทนที่แอนิเมชันสำเร็จแล้ว,Animasyon başarıyla değiştirildi,Hiệu ứng động đã được thay thế thành công,动画替换成功,动画替换成功,已成功取代動畫
Studio.R15Migrator.AvatarSelection.Character,,,Character,Character,الشخصية,Charakter,Personaje,Personnage,कैरेक्टर,Karakter,Personaggio,キャラクター,캐릭터,Postać,Personagem,,ตัวละคร,Karakter,Nhân Vật,角色,角色,角色
Studio.R15Migrator.Summary.Characters,,,Characters,Characters,الشخصيات,Charaktere,Personajes,Personnages,कैरेक्टर,Karakter,Personaggi,キャラクター,캐릭터,Postacie,Personagens,,ตัวละคร,Karakterler,Nhân Vật,字符,字符,角色
Studio.R15Migrator.Summary.Animations,,,Animations ({currentAmount}/{total}),Animations ({currentAmount}/{total}),الرسوم المتحركة ({currentAmount}/{total}),Animationen ({currentAmount}/{total}),Animaciones ({currentAmount}/{total}),Animations ({currentAmount}/{total}),ऐनिमेशंस ({currentAmount}/{total}),Animasi ({currentAmount}/{total}),Animazioni ({currentAmount}/{total}),アニメーション ({currentAmount}/{total}),애니메이션({currentAmount}/{total}),Animacje ({currentAmount}/{total}),Animações ({currentAmount}/{total}),,แอนิเมชัน ({currentAmount}/{total}),Animasyonlar ({currentAmount}/{total}),Hiệu Ứng Động ({currentAmount}/{total}),动画 ({currentAmount}/{total}),动画 ({currentAmount}/{total}),動畫（{currentAmount}/{total}）
Studio.R15Migrator.Summary.Scripts,,,Scripts,Scripts,النصوص البرمجية,Skripte,Scripts,Scripts,स्क्रिप्ट्स,Skrip,Script,スクリプト,스크립트,Skrypty,Scripts,,สคริปต์,Betikler,Kịch Bản,脚本,脚本,指令碼
Studio.R15Migrator.Summary.ConvertHeader,,,[link1] ({currentAmount}/{total}),[link1] ({currentAmount}/{total}),[link1] ({currentAmount}/{total}),[link1] ({currentAmount}/{total}),[link1] ({currentAmount}/{total}),[lien1] ({currentAmount}/{total}),[link1] ({currentAmount}/{total}),[link1] ({currentAmount}/{total}),[link1] ({currentAmount}/{total}),[link1] ({currentAmount}/{total}),[link1] ({currentAmount}/{total}),[link1] ({currentAmount}/{total}),[link1] ({currentAmount}/{total}),,[link1] ({currentAmount}/{total}),[link1] ({currentAmount}/{total}),[link1] ({currentAmount}/{total}),[链接 1] ({currentAmount}/{total}),[链接 1] ({currentAmount}/{total}),[link1]（{currentAmount}/{total}）
Studio.R15Migrator.Summary.Animation,,,Animation,Animation,حركة,Animation,Animación,Animation,ऐनिमेशन,Animasi,Animazione,アニメーション,애니메이션,Animacja,Animação,,แอนิเมชัน,Animasyon,Hiệu Ứng Động,动画,动画,動畫
Studio.R15Migrator.Tabs.Summary,,,Summary,Summary,الملخص,Zusammenfassung,Resumen,Résumé,समरी,Ringkasan,Riepilogo,概要,요약,Podsumowanie,Resumo,,ข้อมูลสรุป,Özet,Tóm Tắt,概要,概要,概要
Studio.R15Migrator.Summary.Sortby,,,Sort by,Sort by,ترتيب حسب,Sortieren nach,Ordenar por,Trié par,इस आधार पर क्रम से लगाएँ,Urutkan berdasarkan,Elenca in ordine,並べ替え:,정렬 기준,Sortuj według,Ordenar por,,เรียงลำดับตาม,Sırala:,Sắp Xếp Theo,排序依据,排序依据,排序方式：
Studio.R15Migrator.Summary.Alphabetical,,,Alphabetical,Alphabetical,أبجديًا,Alphabetisch,En orden alfabético,Alphabétique,वर्णमाला के क्रम में,Alfabetis,Alfabetico,アルファベット順,알파벳 순,Alfabetycznie,Alfabético,,ลำดับตัวอักษร,Alfabetik,Theo Bảng Chữ Cái,字母顺序,字母顺序,依字母排序
Studio.R15Migrator.PublishWarningAction.Continue,,,Continue to Publish,Continue to Publish,المتابعة للنشر,Veröffentlichen fortsetzen,Continuar a Publicar,Continuer à publier,पब्लिश करना जारी रखें,Lanjutkan ke Publikasi,Continua a pubblicare,公開に進む,게시 계속,Przejdź do publikowania,Continuar a publicar,,ดำเนินการต่อเพื่อเผยแพร่,Yayınlamaya devam et,Tiếp tục để Đăng,继续发布,继续发布,繼續發佈
Studio.R15Migrator.PublishWarningAction.Cancel,,,Cancel,Cancel,إلغاء,Abbrechen,Cancelar,Annuler,कैंसिल करें,Batalkan,Annulla,キャンセル,취소,Anuluj,Cancelar,,ยกเลิก,İptal,Hủy Bỏ,取消,取消,取消
Studio.R15Migrator.PublishWarning.Warning,,,R6 conversion is not revertable,R6 conversion is not revertable,لا يمكن التراجع عن تحويل R6,R6-Konvertierung kann nicht rückgängig gemacht werden,La conversión a R6 no es reversible,La conversion R6 n'est pas réversible,R6 कन्वर्ज़न वापस नहीं किया जा सकता है,Konversi R6 tidak bisa dikembalikan,La conversione R6 non è reversibile,R6変換は元に戻すことができません,R6 변환은 되돌릴 수 없습니다,Konwersji R6 nie można cofnąć,A conversão de R6 não é reversível,,การแปลง R6 ไม่สามารถแปลงกลับได้,R6 dönüşümü geri alınamaz,Chuyển đổi R6 không thể hoàn lại,R6 转换不可还原,R6 转换不可还原,R6 轉換無法還原
Studio.R15Migrator.PublishWarning.Detail,,,"Once you publish your converted experience, you will no longer be able to revert any of the associated characters, animations, or scripts.","Once you publish your converted experience, you will no longer be able to revert any of the associated characters, animations, or scripts.",بمجرد نشر التجربة المُحوَّلة، لن تتمكن بعدها من التراجع عن أيٍ من الشخصيات أو الرسوم المتحركة أو النصوص البرمجية المرتبطة بها.,"Sobald du dein konvertiertes Erlebnis veröffentlichst, kannst du keine der zugehörigen Charaktere, Animationen oder Skripte mehr rückgängig machen.","Una vez que publiques tu experiencia convertida, ya no podrás revertir ninguno de los personajes, animaciones o scripts asociados.","Une fois que tu as publié ton expérience convertie, tu ne pourras plus annuler aucun des personnages, des animations ou des scripts associés.","अपने कन्वर्ट किए गए एक्सपीरिएंस को पब्लिश करने के बाद, अब इससे जुड़े किसी भी कैरेक्टर, ऐनिमेशन या स्क्रिप्ट को वापस नहीं किया जा सकेगा.","Setelah memublikasikan pengalaman virtual yang dikonversi, kamu tidak akan bisa lagi mengembalikan karakter, animasi, atau skrip terkait.","Una volta pubblicata l'esperienza convertita, non potrai più ripristinare nessuno dei personaggi, delle animazioni o degli script associati.",変換済みのバーチャル空間を公開すると、関連するキャラクター、アニメーション、またはスクリプトはすべて元に戻すことができなくなります。,"변환된 체험을 게시하고 나면, 관련 캐릭터 또는 애니메이션, 스크립트를 되돌릴 수 없게 됩니다.","Po opublikowaniu przekonwertowanego projektu nie będziesz mieć już możliwości przywrócenia związanych z nim postaci, animacji ani skryptów.","Depois de publicar sua experiência convertida, você não poderá mais reverter nenhum dos personagens, animações ou scripts associados.",,เมื่อคุณเผยแพร่ประสบการณ์ที่แปลงแล้วของคุณ คุณจะไม่สามารถแปลงกลับตัวละคร แอนิเมชัน หรือสคริปต์ใดๆ ที่เกี่ยวข้องได้อีกต่อไป,"Dönüştürülmüş deneyimini yayınladıktan itibaren ilişkili karakterleri, animasyonları veya betikleri geri döndüremeyeceksin.","Sau khi phát hành bản trải nghiệm đã chuyển đổi, bạn sẽ không thể hoàn lại bất kỳ nhân vật, hiệu ứng động hoặc kịch bản nào liên quan.",发布转换的体验后，你将无法还原相关字符、动画或脚本。,发布转换的体验后，你将无法还原相关字符、动画或脚本。,轉換後的體驗一旦發佈，將無法再還原相關角色、動畫或指令碼。
Studio.R15Migrator.InitialFlow.Instructions,,,<b>{experienceName}</b> is an R6 experience that must be converted to R15.,<b>{experienceName}</b> is an R6 experience that must be converted to R15.,<b>{experienceName}</b> عبارة عن تجربة R6 يجب تحويلها إلى R15.,"<b>{experienceName}</b> ist ein R6-Erlebnis, das in R15 konvertiert werden muss.",<b>{experienceName}</b> es una experiencia R6 que debe convertirse a R15.,<b>{experienceName}</b> est une expérience R6 qui doit être convertie en R15.,<b>{experienceName}</b> यह एक R6 एक्सपीरिएंस है जिसे R15 में कन्वर्ट किया जाना चाहिए.,<b>{experienceName}</b> adalah pengalaman virtual R6 yang harus dikonversi menjadi R15.,<b>{experienceName}</b> è un'esperienza R6 che deve essere convertita in R15.,<b>{experienceName}</b> は、R15に変換する必要があるR6のバーチャル空間です。,<b>{experienceName}</b>(은)는 R15로 변환해야 하는 R6 체험입니다.,"<b>{experienceName}</b> to projekt R6, który musi zostać przekonwertowany na R15.",<b>{experienceName}</b> é uma experiência R6 que deve ser convertida em R15.,,<b>{experienceName}</b> คือประสบการณ์ R6 ืที่ต้องได้รับการแปลงเป็น R15,"<b>{experienceName}</b>, R15'e dönüştürülmesi gereken R6 bir deneyim.",<b>{experienceName}</b> là một trải nghiệm R6 và phải được chuyển đổi sang R15.,<b>{experienceName}</b> 是一种必须转换为 R15 的 R6 体验。,<b>{experienceName}</b> 是一种必须转换为 R15 的 R6 体验。,「<b>{experienceName}</b>」是必須轉換為 R15 的 R6 體驗。
Studio.R15Migrator.InitialFlow.Confirmation,,,The R15 experience {experienceNameR15Font} was created on {date}. Click open to finish the process.,The R15 experience {experienceNameR15Font} was created on {date}. Click open to finish the process.,"تم إنشاء {experienceNameR15Font} الخاص بتجربة R15 في {date}. اضغط على ""فتح"" لإنهاء العملية.","Das R15-Erlebnis {experienceNameR15Font} wurde am {date} erstellt. Klicke auf Öffnen, um den Prozess abzuschließen.",La experiencia R15 {experienceNameR15Font} se creó el {date}. Haz clic en abrir para terminar el proceso.,L'expérience R15 {experienceNameR15Font} a été créé le {date}. Cliquer sur ouvrir pour terminer le processus.,R15 एक्सपीरिएंस {experienceNameR15Font} को {date} को बनाया गया था. प्रोसेस पूरा करने के लिए 'खोलें' पर क्लिक करें.,Pengalaman virtual R15 {experienceNameR15Font} dibuat pada {date}. Klik buka untuk menyelesaikan prosesnya.,L'esperienza R15 {experienceNameR15Font} è stata creata il giorno {date}. Fai clic su Apri per terminare il processo.,R15 のバーチャル空間（{experienceNameR15Font}）は {date} に制作されました。開くをクリックしてプロセスを完了してください。,R15 체험 {experienceNameR15Font}(이)가 {date}에 제작되었습니다. '열기'를 클릭해 프로세스를 완료하세요.,"Projekt R15 {experienceNameR15Font} został utworzony {date}. Kliknij Otwórz, aby dokończyć proces.",A experiência R15 {experienceNameR15Font} foi criada em {date}. Clique em abrir para terminar o processo.,,ประสบการณ์ R15 {experienceNameR15Font} ถูกสร้างขึ้นเมื่อวันที่ {date} คลิกเปิดเพื่อเสร็จสิ้นกระบวนการ,"{experienceNameR15Font} R15 deneyimi, {date} tarihinde oluşturuldu. İşlemi tamamlamak için aç seçeneğine tıkla.",Trải nghiệm R15 {experienceNameR15Font} được tạo ra vào ngày {date}. Nhấn mở để hoàn tất quy trình.,,,R15 體驗「{experienceNameR15Font}」建立於 {date}。按一下開啟來結束流程。
Studio.R15Migrator.InitialFlow.GetStarted,,,Get Started,Get Started,البدء,Erste Schritte,Primeros pasos,Commencer,शुरू करें,Mulai,Per iniziare,始める,시작하기,Rozpocznij,Iniciando,,เริ่มใช้งาน,Başla,Bắt Đầu,着手开始,着手开始,立即開始
Studio.R15Migrator.InitialFlow.Complete,,,{experienceName} conversion is complete,{experienceName} conversion is complete,اكتمل تحويل {experienceName},Konvertierung von {experienceName} abgeschlossen,La conversión de {experienceName} está completa,La conversion {experienceName} est terminée,{experienceName} कन्वर्ज़न पूरा हो गया है,Konversi {experienceName} selesai,La conversione di {experienceName} è completa,{experienceName} の変換が完了,{experienceName} 변환이 완료되었습니다,Ukończono konwertowanie projektu {experienceName},A conversão de {experienceName} está completa,,การแปลง {experienceName} เสร็จสมบูรณ์แล้ว,{experienceName} dönüşümü tamamlandı,Chuyển đổi {experienceName} đã hoàn thành,{experienceName} 转换已完成,{experienceName} 转换已完成,「{experienceName}」轉換完成
Studio.R15Migrator.InitialFlow.ThumbnailSubText,,,Ability to keep the blocky style with R15 technology,Ability to keep the blocky style with R15 technology,القدرة على الحفاظ على النمط المتكتل باستخدام تقنية R15,"Fähigkeit, den Block-Stil mit R15-Technologie beizubehalten",Capacidad para mantener el estilo de bloque con la tecnología R15,Possibilité de garder le style Blocky avec la technologie R15,R15 टेक्नोलॉजी के साथ ब्लॉक वाले स्टाइल को बनाए रखने की क्षमता,Kemampuan untuk mempertahankan gaya tampilan balok dengan teknologi R15,Capacità di mantenere lo stile a blocchi con la tecnologia R15,R15 テクノロジーによるブロッキースタイルをキープする能力,R15 기술로 블록 모양 스타일을 유지하는 기능,Możliwość zachowania klockowej stylistyki w technologii R15,Capacidade de manter o estilo bloco com a tecnologia R15,,ความสามารถในการคงไว้ซึ่งสไตล์บล็อคด้วยเทคโนโลยี R15,R15 teknolojisiyle blok stilini koruma olanağı,Khả năng giữ phong cách hình khối bằng công nghệ R15,使用 R15 技术保持砖块样式的功能,使用 R15 技术保持砖块样式的功能,可運用 R15 的技術並保持方塊風格
Studio.R15Migrator.InitialFlow.Explanation,,,"This tool starts by making an R15 copy of the experience, then creates a custom list of suggested replacements for R6 characters, animations, and scripts for you to review. [link1]","This tool starts by making an R15 copy of the experience, then creates a custom list of suggested replacements for R6 characters, animations, and scripts for you to review. [link1]",تبدأ هذه الأداة بإنشاء نسخة R15 من التجربة، ثم تُنشئ قائمة مخصصة بالبدائل المقترحة للشخصيات والرسوم المتحركة والنصوص البرمجية من إصدار R6 حتى تتمكن من مراجعتها. [link1],"Dieses Tool beginnt mit einer R15-Kopie des Erlebnisses und erstellt dann eine benutzerdefinierte Liste von vorgeschlagenen Ersetzungen für R6-Charaktere, -Animationen und -Skripte, die du überarbeiten kannst. [link1]","Esta herramienta comienza por hacer una copia R15 de la experiencia, entonces crea una lista personalizada de reemplazos sugeridos para caracteres R6, animaciones y scripts para que los puedas revisar. [link1]","Cet outil commence par faire une copie R15 de l'expérience, puis crée une liste personnalisée de suggestions de remplacement pour les personnages, les animations et les scripts R6, afin que tu puisses les passer en revue. [lien1]","यह टूल एक्सपीरिएंस की R15 कॉपी बनाकर शुरू होता है, फिर आपके लिए रिव्यू करने के लिए R6 कैरेक्टर, ऐनिमेशन और स्क्रिप्ट के लिए सुझाए गए रिप्लेसमेंट की कस्टम लिस्ट बनाता है. [link1]","Alat ini memulai dengan membuat salinan R15 pengalaman virtual, lalu membuat daftar kustom berisi pengganti yang disarankan bagi karakter, animasi, dan skrip R6 untuk kamu review. [link1]","Questo strumento creerà una copia R15 dell'esperienza, un elenco personalizzato di sostituzioni suggerite per personaggi, delle animazioni e degli script R6 che sottoporrà alla tua revisione. [link1]",このツールは、バーチャル空間のR15コピーを作成することから始めます。 次に、あなたがレビューできるように推奨される他のR6キャラクター、アニメーション、スクリプトのカスタマイズされたリスト作成します。 [link1],"이 도구를 이용하면 먼저 체험의 R15 사본을 만들고, 이후의 검토를 위해 R6 캐릭터, 애니메이션, 스크립트에 대한 권장 대체 항목의 사용자 정의 목록을 만들 수 있습니다. [link1]","To narzędzie tworzy na początku kopię projektu konwertowanego na R15, a następnie tworzy dedykowaną listę sugerowanych zamian postaci, animacji i skryptów R6, którą możesz przejrzeć. [link1]","Esta ferramenta começa fazendo uma cópia R15 da experiência então cria uma lista personalizada de substitutos sugeridos para caracteres R6, animações e scripts para revisar. [link1]",,เครื่องมือนี้จะเริ่มต้นโดยการทำสำเนา R15 ของประสบการณ์ จากนั้นจึงสร้างรายการกำหนดเองของการแทนที่ที่แนะนำของตัวละคร แอนิเมชัน และสคริปต์ R6 ให้คุณได้ตรวจสอบ [link1],"Bu araç, deneyimin R15 bir kopyasını hazırlar ve gözden geçirmen için R6 varlıklar yerine kullanılabilecek karakterlerden, animasyonlardan ve betiklerden oluşan özel bir öneri listesi sunar. [link1]","Công cụ này bắt đầu bằng cách tạo một bản sao R15 của trải nghiệm, sau đó tạo một danh sách tùy chỉnh các đề xuất thay thế cho nhân vật R6, hiệu ứng động và kịch bản để bạn xem xét. [link1]",此工具工作时先制作一份体验的 R15 副本，然后创建 R6 字符、动画和脚本的自定义建议替换列表，可供查看。[链接1],此工具工作时先制作一份体验的 R15 副本，然后创建 R6 字符、动画和脚本的自定义建议替换列表，可供查看。[链接1],此工具首先會製作體驗的 R15 副本，然後為 R6 角色、動畫和指令碼建立一份建議取代的專門清單供您檢視。[link1]
Studio.R15Migrator.InitialFlow.Open,,,Open,Open,فتح,Öffnen,Abrir,Ouvrir,खोलें,Buka,Apri,開く,열기,Otwórz,Abrir,,เปิด,Aç,Mở,打开,打开,開啟
Studio.R15Migrator.InitialFlow.InProgress,,,{experienceName} conversion is in progress...,{experienceName} conversion is in progress...,جارٍ تحويل {experienceName}...,Konvertierung von {experienceName} läuft …,La conversión de {experienceName} está en curso...,La conversion {experienceName} est en cours...,{experienceName} कन्वर्ज़न जारी है...,Konversi {experienceName} sedang berlangsung...,La conversione di {experienceName} è in corso...,{experienceName} の変換が進行中です...,{experienceName} 변환이 진행 중입니다...,Trwa konwertowanie projektu {experienceName}...,A conversão de {experienceName} está em andamento...,,การแปลง {experienceName} กำลังอยู่ในระหว่างดำเนินการ...,{experienceName} dönüşümü sürüyor...,Đang tiến hành chuyển đổi {experienceName}...,{experienceName} 转换正在进行中......,{experienceName} 转换正在进行中......,「{experienceName}」轉換進行中……
Studio.R15Migrator.AnimationStatus.FailedWithError,,,Upload failed. Error: {error},Upload failed. Error: {error},تعذَّر الرفع. خطأ: {error},Upload fehlgeschlagen. Fehler: {error},Error al cargar: {error},Échec du téléchargement. Erreur : {error},अपलोड नहीं किया जा सका. गड़बड़ी : {error},Upload gagal. Eror: {error},Caricamento non riuscito. Errore: {error},アップロードできませんでした。エラー: {error},업로드 실패. 오류: {error},Nie udało się przesłać. Błąd: {error},Falha no upload. Erro: {error},,อัปโหลดไม่สำเร็จ ข้อผิดพลาด: {error},Yükleme başarısız. Hata: {error},Tải lên không thành công. Lỗi: {error},上传失败。错误：{error},上传失败。错误：{error},上傳失敗。錯誤：{error}
